{"$schema":"https://json-schema.org/draft/2020-12/schema","type":"object","additionalProperties":false,"required":["decision_id","as_of_date","transaction_date","facts","assumptions","rules_applied","evidence","interpretation","conclusion","confidence","requires_human_review","unresolved_questions"],"properties":{"decision_id":{"type":"string","minLength":1},"as_of_date":{"type":"string","format":"date"},"transaction_date":{"type":"string","format":"date"},"facts":{"type":"object"},"assumptions":{"type":"array","items":{"type":"string"}},"rules_applied":{"type":"array","items":{"type":"object","required":["rule_id","source_id","source_version","effective_from","effective_to","rule_summary"],"properties":{"rule_id":{"type":"string"},"source_id":{"type":"string"},"source_version":{"type":["string","null"]},"effective_from":{"type":["string","null"],"format":"date"},"effective_to":{"type":["string","null"],"format":"date"},"rule_summary":{"type":"string"}},"additionalProperties":false}},"evidence":{"type":"array","items":{"$ref":"evidence.schema.json"}},"interpretation":{"type":"string"},"conclusion":{"$ref":"tax-conclusion.schema.json"},"confidence":{"enum":["high","medium","low"]},"requires_human_review":{"type":"boolean"},"unresolved_questions":{"type":"array","items":{"type":"string"}}}}